,id,name,cluster,latitude,longitude,img,call,oneliner,detail,isPark
0,travel_부산_00184,부산 송도해수욕장,0,35.0768199198884,129.0180495332,https://cdn.visitkorea.or.kr/img/call?cmd=VIEW&id=ebec5e1d-cf76-4370-9a7d-009fb3994148,,부산 최초로 개장한 해수욕장,"백사장 길이 800m, 너비 50m, 평균수심 1~1.5m. 부산 자갈치시장에서 3km 떨어진 곳에 위치하며, 부산에서 제일 먼저(1913년) 개장한 해수욕장이다. 2000년부터 5년여 간 정비사업을 펼쳐 줄어든 백사장을 확장하고 분수대 등을 설치하며 해변공원이 되었다. 주위에 수산시장과 암남공원 등이 있다.1913년 부산에서 최초로 개발된 해수욕장 구역으로, 1996년 4월, 군사보호구역에서 개방된 도시 자연공원인 암남공원과 바다낚시로 유명한 두도공원으로 연결된 송도는 울창한 원시림과 자연 그대로 보존된 기암괴석, 그리고 부산의 상징인 갈매기와 멀리 영도를 배경으로 한 조용한 바다정경이 장관인 곳이다.
 

 주변에 다양한 숙박시설과 먹을거리를 갖추고 있으며 구름다리, 산책로, 보트장, 주차장 등 편의시설이 잘 갖추어져 있다. 송도 해안의 암남공원은 해안 생태 공원으로 송도 해안과 부산 남항을 한눈에 담을 수 있는 전망대, 3.8km의 산책로, 도로변 카페, 횟집들이 즐비한 곳이다. 부산시 서구 부민동 3가에는 한국전쟁 중 부산이 임시 수도였을 때 3년 동안 대통령 관저로 사용된 임시수도기념관이 있다. 송도는 이처럼 격변의 역사를 보낸 서구 암남동 장군반도 남단에 자리잡고 있다.",있음(17개소/670대)
204,food_부산_00476,제일 산꼼장어,0,35.0971902299582,129.032279025761,https://cdn.visitkorea.or.kr/img/call?cmd=VIEW&id=7b6d04c4-6bd7-403f-8392-e8a59580137a,051-245-8990,,"※ 영업시간 10:00 ~ 24:00

제일 산꼼장어는 자갈치시장 인근에 있는 곰장어 연탄구이 전문 음식점이다. 대표 메뉴인 산꼼장어(석쇠·소금·양념구이)를 연탄구이로 맛볼 수 있으며, 이외에도 장어구이, 새우·조개구이를 맛볼 수 있다. 지하철 이용 시 남포역 2번 출구에서 남포동 주민센터(자갈치시장) 방면으로 걸어오면 된다.",
1,travel_부산_00095,부산 감천문화마을,0,35.0974881365854,129.010608479318,https://cdn.visitkorea.or.kr/img/call?cmd=VIEW&id=58a44a35-5f34-4a39-a780-a292d8e76a3d,,반려동물과 어린왕자 포토존에서 견생샷 남길 수 있는 곳,"감천문화마을은 1950년대 6.25 피난민의 힘겨운 삶의 터전으로 시작되어 현재에 이르기까지 부산의 역사를 그대로 간직하고 있는 곳이다. 산자락을 따라 질서정연하게 늘어선 계단식 집단 주거형태와모든 길이 통하는 미로같은 골목길의 경관은 감천만의 독특함을 보여준다.<부산의 낙후된 달동네였지만 문화예술을 가미한 도시재생사업을 추진하면서 지금은 연간 185만명의 국내외 관광객이 다녀가는 대표 관광명소가 되었다. 산비탈을 따라 계단식으로 들어선 아름다운 파스텔톤의 집들과 미로와 같은 골목길이 있어 한국의 마추픽추, 산토리니로 불린다. 2016년 대한민국 공간문화대상 최고상인 대통령상을 수상하기도 했다.감천문화마을에서는 아름다운 자연과 어우러진 그림같은 마을의 풍경을 즐기면서, 골목골목 설치된 다양한 형태의 작품을 감상할 수 있으며, 감천문화마을 내 입주작가들의 공방을 통해 다양한 공예 체험도 가능하여 관광객들이 끊임없이 찾고 있다.",
3,travel_부산_00019,청학 수변공원,0,35.097673147049,129.061133845771,https://cdn.visitkorea.or.kr/img/call?cmd=VIEW&id=68ab17d7-3b84-4248-a51b-19b84d48531f,,민간 최초의 수변공원,"청학 수변공원은 부산 항만공사와 부산 지방해양항만청이 함께 조성한 민간 최초의 수변공원이다. 바다 가까이 있어 부산항대교를 가장 가까이서 볼 수 있는 공원으로도 유명하다. 조경은 물론이고 체육시설까지 잘 갖춘 공원으로 동해안 국토종주 자전거길에 포함되어 있어 자전거 타기에도 적합하다. 최근 야경이 아름다운 부산항대교 야경 촬영 명소로 알려지면서 영도의 새로운 관광 핫스폿으로 급부상 중이다. 부산항대교 점등시간은 일몰 후 20분부터 11시까지이니 촬영이 목적이라면 미리 점등 시간을 체크한 뒤 방문하는 것이 좋다.
 

 (공지사항) 부산항대교 점등시간 확인 https://www.bukhangbr.com/intro/intro_04.php",없음
256,food_부산_00507,목장원,0,35.0716400952136,129.057362356798,https://cdn.visitkorea.or.kr/img/call?cmd=VIEW&id=8d1c33b9-a627-4747-91e8-a1ed740c5510,051-404-5000,오션뷰로 눈과 입이 즐거운 곳,"한국 전통의 토속적인 분위기와 현대적인 세련미를 두루 갖춘 식당으로 각 층마다 특징 있는 인테리어와 부산지역에서 최대 규모를 자랑하고 있다. 식사 후 산책로와 전망대에서 가족, 친구와 함께 휴식을 취할 수도 있다.",주차 가능
2,travel_부산_00143,다대포항,0,35.0526385136988,128.983440197913,https://cdn.visitkorea.or.kr/img/call?cmd=VIEW&id=7aa2f92d-685f-4674-958a-1ebc726c9807,,,"다대포항은 부산에서도 가장 서쪽에 위치하고 있는 항구이다. 부산항처럼 무역항이 아니라 대형어선은 없는 주로 중소형 어선이 많은 작고 아담한 항구이다. 바다에서 잡아온 수산물을 경매하는 위판장이 있고 수산시장이 함께 있어서 갓 잡아온 신선한 생선을 저렴한 가격으로 살 수도 있다. 어선이 많이 정박해 있는 곳이다 보니 주변에 대형 가공공장, 냉동공장이 위치하고 있고 회센터도 많이 자리하고 있어서 계절마다 신선한 수산물을 구경하고 맛볼 수 있는 곳이다. 다대포항과 이어진 다대포해수욕장과 함께 일출, 일몰로 유명한 곳이라 사진을 찍으러 오는 사람들을 쉽게 볼 수 있다. 특히 일출 명소로 알려져 있는데 일출 일몰 때에는 포구 한쪽에 세워져 있는 나무선착장이 어우러지며 그림 같은 풍경이 연출된다. 몰운대전망대로 올라가서 다대포항을 바라보면 산에 둘러 쌓여있는 듯한 다대포항을 내려다볼 수 있는데 작은 항구라 포근한 느낌을 준다. 이곳이 알려지면서 아름다운 장관도 보고 신선한 수산물을 맛보러 오는 발걸음이 늘고 있다.",있음
93,hotel_부산_00094,호텔 아쿠아펠리스,0,35.1541281370913,129.118815897298,https://cdn.visitkorea.or.kr/img/call?cmd=VIEW&id=5504cd5c-c13f-43c9-8a43-a7f7ed9cfdab,051-790-2300,부산의 아름다움을 자랑하는 광안리에 위치한 호텔,"호텔 아쿠아팰리스는 부산의 아름다움을 자랑하는 광안리에 위치한 호텔이다. 광안대교의 아름다움을 그대로 담은 오션뷰 객실은 물론 지하 816m에서 솟아나는 38℃천연 해수 온천을 보유하여 24시간 운영되는 오션뷰 사우나 및 찜질방 그리고 한국 최초 실내 워터파크를 갖춘 실내 복합형 워터파크 특급호텔이다. 내 인생의 반쪽과 함께하는 특별하고 아름드운 오션뷰 웨딩, 최점단 조명과 음향시설을 갖춘 대규모연회와 각종 세미나에 적합한 연회장들이 갖추어져 있다. 또한 광안대교 바다 전망과 함께 즐기는 퓨전 일식당과 광안리 해변과 광안대교를 온몸으로 느낄 수 있는 스카이워크가 대표적인 랜드마크이다.",주차가능
4,travel_부산_00195,동래문화회관,1,35.2119506866483,129.090545961812,https://cdn.visitkorea.or.kr/img/call?cmd=VIEW&id=4e7b8425-e824-4883-99c7-a74d12603566,,시민들의 열린 휴식공간,"동래문화회관은 부산 유일의 숲속공연장으로 공연장 주변에는 동래읍성과 복천박물관 그리고 장영실 과학동산이 자리 잡고 있어 공연은 물론 역사적 경험을 할 수 있는 부산의 대표공연장이다. 대극장(524석), 소극장(200석), 야외공연장(1,130석), 전시실을 두루 갖추고 있는 우리 문화회관은 열린 휴식공간으로 마음 따뜻한 행복을 만끽할 수 있을 것이다.
 

 * 개관일 : 1999년 10월",주차 가능
383,food_부산_00248,수영 돼지국밥,1,35.161748170964,129.114439089243,https://cdn.visitkorea.or.kr/img/call?cmd=VIEW&id=14b65143-06bd-4dff-92ee-9997132182bd,051-758-5046,수요미식회에 소개된 돼지국밥 맛있는 곳,"수영돼지국밥은 부산 돼지국밥의 정석, 뽀얀 국물의 돼지국밥이 유명한 광안리 해수욕장 근처 돼지국밥집이다. 부추겉절이나 새우젓, 고추장 양념을 넣어 먹는 돼지국밥, 모둠 국밥 등의 메뉴가 있고, 항정살 수육을 맛볼 수 있는 수육 백반이 인기 있다. 수영돼지국밥은 국이 보드랍고, 담백한 맛이 특징이다. 돼지 다리뼈만 넣고 우려낸 뽀얀 국물의 돼지국밥을 맛볼 수 있다. 6시간 동안 푹 고아 낸 국물은 구수한 맛을 내며 누린내가 나지 않아 돼지국밥을 처음 접하는 사람들도 부담스럽지 않게 즐길 수 있다. 김치가 중국산이 아니고, 국내산이라는 점이 장점이며 김치뿐 아니라 다른 메뉴들도 국내산을 사용한다. 전용 주차장이 있다. 광안리해수욕장이 인접해 있어 함께 둘러보기 좋다.",있음(무료)
5,travel_부산_00006,해운대리버크루즈,1,35.167908247558,129.127317311652,https://cdn.visitkorea.or.kr/img/call?cmd=VIEW&id=a8696058-4333-4deb-a61e-cf6bdbe10497,,크루즈를 타고 떠나는 도심 속 여행,"APEC 나루공원을 출발하여 마린시티, 광안대교를 볼 수 있는 코스로 강과 바다를 모두 볼 수 있는 부산 최초의 도심형 유람선. 데이 크루즈, 나이트 크루즈 및 디너 크루즈로 정규 운항이 편성되어 있어 수영강과 해운대, 광안리 바다의 낮과 밤을 한 번에 즐길 수 있다. 2022년 8월 최신형 럭셔리 요트가 입고되어 넓고 고급스러운 실내와 더 넓은 2층 야외 루프탑 공간을 이용할 수 있다. 단체 행사 등 다양한 이벤트를 열기에도 좋다.",
6,travel_부산_00120,삼익비치수변공원,1,35.1461443836988,129.115325581127,https://cdn.visitkorea.or.kr/img/call?cmd=VIEW&id=d2d0c1d3-17be-4b26-ab9c-24c207ceaff8,,,"광안리해수욕장이 한눈에 들어오는 삼익비치 수변공원은 낮에는 산책이나 자전거를, 밤에는 화려한 야경을 즐기기에 더없이 좋은 장소다. 특히 부산을 대표하는 야경명소로 꼽히는 광안리해수욕장은 푸른 바다와 우리나라 최초의 2층 해상교량이자 최대 규모의 현수교를 자랑하는 광안대교가 어우러진 풍광이 압권이다. 시간대와 요일, 계절별로 무려 10만 가지 이상의 다양한 색상을 연출하는 경관 조명시설도 야경의 화려함을 더한다. 삼익비치 수변공원에서 바라보는 광안대교는 해수욕장과는 또 다른 각도로 매력을 뽐낸다. 해 질 무렵의 핑크빛 노을도 더 가까이에서 감상할 수 있다. 해마다 봄이 되면 현지인들은 물론 관광객들도 일부러 찾는 삼익비치 벚꽃길과도 연결돼 볼거리를 더한다.",주차가능
218,food_부산_00251,하론테라스,1,35.1568124461,129.134474818443,https://cdn.visitkorea.or.kr/img/call?cmd=VIEW&id=b230adae-65c1-420e-98ba-6912532eb19b,0507-1401-5556,야경이 멋진 파스타 맛집,"광안리 뷰 맛집으로 알려진 하론테라스는 광안대교와 마린시티 바다 전망을 볼 수 있는 이탈리안 레스토랑이다. 주차는 건물 1층을 이용하면 되는데 점심시간, 주말에는 협소하여 근처 공영주차장 이용을 추천한다. 큰 규모의 내부는 조명, 라탄, 식물 등을 활용하여 이국적인 분위기가 느껴지는 곳이다. 창가 쪽 자리는 통창으로 낮에는 탁 트인 바다 전망을 볼 수 있고, 저녁에는 화려한 부산의 야경을 볼 수 있다. 또 야외 공간에 앉으면 마린시티 뷰를 한눈에 볼 수 있어 날이 좋을 땐 사람들로 꽉 찬다. 착석 후 테이블에 있는 키오스크로 주문을 하면 되는 하론테라스는 파스타 맛집으로도 알려져 있다. 근처 걷기 좋은 민락공원과 수변공원도 있어 함께 둘러보기 좋다.
※ 반려동물 동반 불가",있음 / 주차요금 무료
7,travel_부산_00224,누리마루 APEC하우스,1,35.1523420491527,129.151361902653,https://cdn.visitkorea.or.kr/img/call?cmd=VIEW&id=1a863a9f-4bf6-4215-a407-2a63616ef54f,051-743-1974~5,"동백섬의 새로운 명물, 누리마루 APEC하우스","* 동백섬의 새로운 명물, 누리마루 APEC하우스 *
 

 누리마루 APEC하우스는 2005년 11월 18~19일에 열린 제13차 APEC 정상회담 회의장으로 해운대구 중동(中洞)의 동백섬에 세운 건축물이다. 누리마루 APEC하우스 명칭은 순수 우리말인 누리(세상, 세계),마루(정상, 꼭대기)와 APEC회의장을 상징하는 APEC하우스를 조합한 것으로“세계정상들이 모여 APEC회의를 하는 집”이라는 뜻을 가지고 있다. 울창한 동백나무와 송림으로 둘러싸인 자연경관이 아름다운 동백섬에 위치해 있으며 APEC 이후 기념관 및 고급 국제회의장으로 활용되고 있다.
 

 누리마루는 지상 3층의 건축물로 건물 전체의 조형은 한국전통의 건축인 “정자”를 현대적으로 표현했으며, 지붕의 형태는 동백섬의 능선을 형상화하였고, 내부장식은 한국의 창조적 전통문화를 시각적으로 표현하였다. 우리나라 대청마루를 컨셉으로 한 테라스에서는 오륙도, 광안대교, 달맞이 언덕 등을 조망할 수 있으며, 해운대 해수욕장과 인접하여 해운대 절경을 감상 할 수 있을 뿐만 아니라, 자연미와 현대미를 고루 갖춘 고품격 국제 회의장으로서의 면모를 갖추고 있다.
 

 * 알면 재미있는 누리마루 APEC하우스 건물 디자인 *
 

 누리마루 APEC하우스의 전체 건물 구조는 한국 전통 건축인 정자를 현대식으로 표현하였으며, 지붕은 동백섬의 능선을 형상화하였다. 12개의 외부 기둥은 부산의 역동적인 모습을, 내부 장식은 한국의 전통문화를 시각적으로 표현하였다. 그 밖에 대들보 꼴로 만들어 전통 단청을 입힌 로비 천장과 대청마루 느낌을 받도록 한 로비 바닥, 석굴암 천장을 모티브로 설계한 정상회의장, 구름 모양을 형상화한 오찬장 등 건물 구석구석마다 한국 전통 양식이 짙게 배어 있다.",주차 가능
94,hotel_부산_00095,아난티 힐튼,1,35.198193058227,129.228583889941,https://cdn.visitkorea.or.kr/img/call?cmd=VIEW&id=25c09b92-9400-4623-9299-02c3bc7db966,051-509-1111,하늘과 바다를 가득 안은 완벽한 휴식처,"아난티 힐튼은 부산의 숨은 아름다운 해변을 품은 기장에 위치해 도심 속에서 만나는 완벽한 휴식처(Urban Destination Retreat)’라는 차별화된 컨셉과 규모, 서비스로 이국적이고 색다른 경험을 누릴 수 있다. 아난티 힐튼은 최근 부산의 새로운 관광 명소로 각광받고 있는 오시리아 관광단지의 중심이자 아난티 코브에 위치해 해운대 해수욕장과 센텀시티, MICE 산업의 중심지인 BEXCO에서도 지리적 이점과 편리한 접근성을 갖추고 있다. 60㎡ 이상의 넓은 객실 규모를 갖춘 객실에서는 프라이빗 발코니가 마련되어 푸른 빛 청명한 하늘을 배경으로 탁 트인 오션뷰 또는 마운틴 뷰를 마음껏 감상 할 수 있다. 동서양을 넘나드는 라이브 쿠킹 스테이션, 다모임 레스토랑에서는 트렌디한 다이닝을 경험할 수 있으며, 최고 층에 위치한 맥퀸즈 라운지에서는 여유로운 오후를 위한 애프터눈티를, 맥퀸즈 바에서는 바다를 마주하며 프렌치 믹솔로지스트가 선사하는 다양한 칵테일을 즐길 수 있다.
파노라믹처럼 펼쳐지는 오션 뷰를 마주한 대규모 연회장과 7개의 미팅과 이벤트를 위한 공간을 갖추고 있으며. 그랜드 볼룸은 1,417sqm 규모로 최대 1,500명까지 수용이 가능하고, 볼룸은 977sqm 규모로 아름다운 오션뷰를 감상할 수 있다. 특히 환상적인 바다 전망의 웨딩 채플과 오션 테라스에서는 프라이빗하면서도 이국적인 웨딩을 실현할 수 있다. 여름에는 바다와 맞닿은 듯한 인피니티 풀, 성인 전용 인피니티풀, 키즈 풀, 자쿠지 등 취향에 따라 선택할 수 있으며, 피트니스와 사우나, 테라피룸 등의 부대시설들이 함께 마련되어 있다. 겨울에는 천연 온천욕을 즐길 수 있는 아난티 워터하우스와 국내외 서적들과 다양한 소품으로 가득한 이터니 저니가 있어, 레저와 문화를 동시에 경험할 수 있으며 사계절 내내 완벽한 휴식을 선사한다.

* 우리나라 최고의 오션 인피니티 풀
외국의 유명 리조트처럼 바다와 맞닿은 오션 인피니티 풀을 경험하고 싶다면, 제대로 된 호텔 서비스를 누리며 여유로운 물놀이를 즐기고 싶다면 아난티 힐튼을 추천한다.
18.5 x 40 x 1m 규모의 인피니티 풀을 비롯해 2층에 위치한 성인 전용 인피니티 풀 등 마치 외국에 온 것 같은 분위기를 자아내는 아난티 힐튼의 야외 수영장은 여유로운 물놀이와 동선을 제공한다. 풀 사이드에 넉넉하게 준비된 데이 베드는 태닝을 하거나 낮잠을 즐기기에 적합하다.
아난티 힐튼은 실내 수영장도 특별하다.
전면이 통유리로 둘러싸여 있어 사계절 내내 바다 풍경을 감상하며 수영을 즐길 수 있고, 다양한 넓이와 깊이의 풀을 갖추어 아이들도 안심하고 이용할 수 있다.

* 따로, 또 같이 가족 여행에 최적화된 넓고 여유로운 객실
아난티 힐튼의 모든 객실은 일반 호텔의 1.5배 이상인 프라이빗 발코니 포함 약 21평(70㎡)의 넓은 규모로 보다 쾌적하고 편안한 휴식의 즐거움을 선사한다. 객실마다 프라이빗 발코니가 있어 바다와 숲의 풍경, 바람과 공기를 보다 가까이 누릴 수 있다.
트윈 베드 객실에는 두 개의 침대를 하나로 연결할 수 있는 레일 시스템이 적용되어 있어 어린 자녀와 함께하는 여행에서 보다 안전하고 편안한 수면이 가능하다.
또한 여러 명의 일행과 동반 여행 시 커넥팅 룸을 선택한다면 두 개의 객실을 따로 또 같이 사용하는 편리함도 누릴 수 있다.

아난티 코브의 펜트하우스는 회원제로 운영되므로 주차장 및 출입에 제한이 있다.",주차 가능(400여대)
8,travel_부산_00173,월전포구(월전방파제),2,35.2378637098117,129.245349149867,https://cdn.visitkorea.or.kr/img/call?cmd=VIEW&id=b8826ba6-58d2-4e8c-bb22-30ae12e30f58,,아담한 항구로 장어구이가 유명한 곳,"월전포구는 아담한 항구로 장어구이가 유명하다. 때문에 포구 주변으로 작은 횟집들과 장어구이집들이 올망졸망 몰려 있다. 월전 방파제에서는 낚시를 즐기는 낚시꾼들이 새벽부터 자리를 잡는 모습이 흔하다. 월전방파제 끝에 세워진 월전등대는 2009년 9월부터 첫 점등을 했다고 하는데 월전-마음에 뜬달이라는 의미를 지닌다. 다른 등대와는 달리 1, 2층이 전망대로 구성되어 둘러보기 좋다. 인근에는 월전 꽃동산, 월전활어판매장이 위치해 있으며, 월전 꽃동산에서는 해변을 따라 걸을 수 있도록 산책로가 마련되어 있다.",
198,food_부산_00345,튼튼장어 무한리필,2,35.2601003617027,129.233139763539,https://cdn.visitkorea.or.kr/img/call?cmd=VIEW&id=6bb291dd-d4fb-46b9-a48e-c2c03a8e4801,051-722-5599,질 좋은 장어를 무제한으로 먹을 수 있는 곳,"부산 일광역 1번 출구 근처에 있어 접근성이 뛰어난 튼튼장어는 뷔페를 겸한 무한리필 장어 전문점이다. 잘 손질된 장어를 직접 골라 불판에서 구워 먹을 수 있다. 장어 외에도 삼겹살, 훈제 오리, 소시지, 주꾸미, 새송이 등 여러 종류의 메뉴를 무제한으로 이용할 수 있다. 셀프 반찬대에는 깻잎, 마늘, 양파, 초 생강, 고추냉이, 쌈무 등 여러 가지의 채소가 있다. 또 샐러드, 치즈스틱, 치킨 윙, 볶음밥, 초밥, 구운 떡, 오렌지, 방울토마토 등 밥과 디저트가 준비되어 있다. 기본 흰쌀밥과 장엇국도 제공된다. 장어를 잘 못 먹는 아이도 다양한 메뉴가 준비되어 있어 부담 없이 올 수 있다. 4세 이하는 무료 이용할 수 있으며 만 65세 이상은 경로 우대 할인이 가능하니 방문 시 신분증 또는 사진을 가지고 가면 좋다. 식당 바로 앞 일광해수욕장이 있어 식사 후 가볍게 산책하는 것도 좋다.",있음(무료)
9,travel_부산_00071,젖병등대,2,35.2137050134373,129.223291136164,https://cdn.visitkorea.or.kr/img/call?cmd=VIEW&id=e2c7359b-de2e-4f15-9da8-d02e47a53ac7,,,"2009년 부산지방해양항만청에서 만든 젖병 모양의 등대다. 등대를 세운 2009년은 부산이 전국에서 출산율이 가장 낮은 도시로 10년째 선정되던 해로, 저출산 시대의 위기를 극복하고자 출산 장려를 기원하는 의미에서 만들어졌다. 부산에 사는 영·유아 144명의 발 도장과 손 도장이 양각으로 제작되어 있다. 방파제 길을 따라가면 연도별로 출산율이 어떻게 변화해왔는지도 볼 수 있다. ‘딸·아들 구별 말고 둘만 낳아 잘 기르자’던 시대에서 ‘잘 키운 딸 하나 열 아들 안 부럽다’가 되었다가 이제는 ‘아이가 미래’라는 시대가 되었다. 이색적인 등대에서 인생 샷을 찍기 위해 전국에서 많은 관광객들이 몰려들고 있다.",있음
10,travel_부산_00039,롯데월드 어드벤처 부산,2,35.1960618136802,129.213206917811,https://cdn.visitkorea.or.kr/img/call?cmd=VIEW&id=b958fb33-4fa5-45e8-baa6-59c33d07c9d4,,숲속의 청량함! 짜릿한 스릴감!,"마법과 환상의 세계! 롯데월드 어드벤처가 부산에서 개장했다. 숲속의 청량함과 짜릿한 스릴감을 완벽하게 즐길 수 있도록 준비되어 있다. ''놀이공원''하면 떠오르는 언제나 즐겁고 신나는 공연 그리고 퍼레이드를 경험할 수 있다.
 부산롯데월드는 대한민국 제 2의 도시라고 불리는 부산에 세워진데다 대중교통을 이용한 접근성도 편리해 개장 첫날부터 끊임없는 발길이 이어지고 있다. 롯데월드 부산은 6개의 테마존으로 꾸려져 있다. 요정 마을 팅커폴스 존 중심에 토킹트리가 있는데 이 나무는 애니매트로닉스 기술이 적용되어 파크 내 6개 테마에 대한 이야기를 들려준다. 롯데월드 내 가장 높은 곳에 위치한 로얄가든 존의 로리캐슬은 물에 떠있는 듯한 모습으로 연출되어 있으며 부산의 전경과 함께 기장 앞 바다를 한눈에 즐길 수 있다. 이외의 놀이 기구들 특히 자이언트 디거, 자이언트 스플래쉬 등 대표 어트랙션은 그 짜릿함이 벌써 입소문을 타고 있다.
 이렇게 어른들을 위한 어트랙션 뿐만 아니라 유아를 동반한 가족 이용객을 위한 놀이 기구도 준비되어 있다. 날씨와 관계 없이 아이와 안전하게 즐길 수 있도록 실내에 배치되어 있다. 놀이공원의 하이라이트라고 할 수 있는 퍼레이드는 하루에 2번, 약 30분간 진행된다.",주차가능
407,food_부산_00226,로아누,2,35.2734857213912,129.23221537963,https://cdn.visitkorea.or.kr/img/call?cmd=VIEW&id=3027fe02-73df-4ee2-891e-90814c2a8a36,0507-1471-1182,기장 일광 핫한 메뉴 우대갈비 맛집,"우대 갈비가 맛있는 부산 기장 로아누는 외관은 카페 같지만, 우대갈비, 이베리코 맛집이다. 야외 우드캐빈에서 감성 캠핑을 할 수 있다. 실내석은 예약받지 않고, 우드 캐빈은 예약 필수다. 우대 갈비가 메인 메뉴이며 목살도 맛이 좋다. 우대 갈비는 2인분 이상 주문해야 한다. 우대갈비를 주문하면 직원이 간단한 설명 후 구워 주는데 우대에 붙은 살을 발라 양념 후 구워 준다. 주차 공간도 넓어서 주차하기 편리하다. 10분 거리에 롯데 프리미엄아울렛, 신세계 아울렛, 제2 롯데월드, 스카이 라이너 루지 부산, 해동용궁사 등이 있다.",있음 / 주차요금 무료
