,id,name,cluster,latitude,longitude,img,call,oneliner,detail,isPark
11,travel_부산_00248,해동 용궁사(부산),2,35.1882392674714,129.223245860198,https://cdn.visitkorea.or.kr/img/call?cmd=VIEW&id=0cd9365b-d018-4963-8d5b-a7e4ad9576e4,051-722-7744,바닷물이 바로 발 아래서 철썩대는 수상법당,"* 소원을 이루어주는 염험한 곳, 해동 용궁사(부산) *
 해동 용궁사는 1376년 공민왕(恭民王)의 왕사(王師)였던 나옹대사(懶翁大師)의 창건으로 한국삼대관음성지(三大觀音聖地)의 한 곳이며 바다와 용과 관음대불이 조화를 이루어 그 어느 곳보다 신앙의 깊은 뜻을 담고 있으며, 진심으로 기도를 하면 누구나 꼭 현몽을 받고 한가지 소원을 이루는 염험한 곳으로 유명하다. 임진왜란의 병화로 소실되었다가 1930년대 초 통도사의 운강(雲崗)이 중창하였다. 1974년 정암(晸菴)스님이 이 절의 주지가 되어 관음도량으로 복원할 것을 발원하고 백일기도를 하였는데, 꿈에서 흰옷을 입은 관세음보살이 용을 타고 승천하는 것을 보았다 하여 절 이름을 해동용궁사로 바꾸었다.
 

 현존하는 건물은 대웅전을 비롯하여 굴법당·용왕당(용궁단)·범종각·요사채 등이 있다. 대웅전은 주지 정암이 1970년대에 중창하였다. 대웅전 옆에 있는 굴법당은 미륵전이라고 하여 창건 때부터 미륵좌상 석불을 모시고 있는데 자손이 없는 사람이 기도하면 자손을 얻게 된다 하여 득남불이라고 부른다. 대웅전 앞에는 사사자 3층 석탑이 있다. 원래 이 자리에는 3m 높이의 바위(미륵바위)가 있었는데 임진왜란 때 절이 폐허가 되고 6·25전쟁 때 해안경비망 구축으로 파괴됨에 따라, 1990년에 정암이 파석을 모으고 손상된 암벽을 보축하여 이 석탑을 세우고 스리랑카에서 가져온 불사리 7과를 봉안하였다. 이밖에 단일 석재로는 한국 최대의 석상인 약 10m 높이의 해수관음대불, 동해 갓바위 부처라고도 하는 약사여래불이 있다. 절 입구에는 교통안전기원탑과 108계단이 있고, 계단 초입에 달마상이 있는데 코와 배를 만지면 득남한다는 전설이 전한다.
 

 * 해동용궁사 인근의 볼거리 *
 주차장에서 내려 2분만 걸어가면 동양철학의 육십갑자 십이지상이 봉안되어 있고 우리 모두의 안정운행을 기원하는 교통 안정 기원 탑이 조심운전을 당부한다. 풍광을 찬탄한 춘원 이광수의 시비와 ""청산은 나를 보고 말 없이 살라하고 창공은 나를 보고 티없이 살라하네"" 라고 노래한 저 유명한 나웅화상의 시귀는 잠시나마 나 자신을 다시 한번 돌아보게 한다. 용문석굴을 지나 108돌계단을 한 계단 한계단 내려가면 정렬된 석등군, 검푸른 넓은 바다는 실제 용궁으로 들어가는 기분으로 감탄과 환희 그 자체이다. 왼쪽으로 백호바위에 약사여래석불이 모셔져 있고 조금만 더 가면 해가 제일 먼저 뜨는 일출암이 자리하고 있다.",
